{
  "schemaVersion": "1.0.0",
  "clientId": "11111111-1111-4111-8111-111111111111",
  "jobId": null,
  "version": "1.0.0",
  "scope": "CLIENT",
  "entries": [
    {
      "entryId": "12121212-1212-4121-8121-121212121212",
      "term": "星河科技股份有限公司",
      "aliases": [
        "星河科技"
      ],
      "entityType": "ORGANIZATION",
      "caseMode": "INSENSITIVE",
      "matchMode": "EXACT",
      "handling": "TOKENIZE",
      "enabled": true,
      "createdAt": "2026-08-25T08:00:00Z",
      "updatedAt": null
    }
  ],
  "createdAt": "2026-08-25T08:00:00Z",
  "updatedAt": "2026-08-25T08:10:00Z"
}
